{
  "classPets": {
    "pet_bear": {
      "attrs": {
        "CON": 16,
        "DEX": 6,
        "INT": 4,
        "STR": 14
      },
      "class": "companion",
      "className": "Companion",
      "description": "A massive bear called from the deep woods. Absorbs punishment.",
      "id": "pet_bear",
      "isCompanion": true,
      "isPet": true,
      "level": 1,
      "name": "Cave Bear",
      "ownerClass": "druid"
    },
    "pet_bone_golem": {
      "attrs": {
        "CON": 18,
        "DEX": 4,
        "INT": 2,
        "STR": 16
      },
      "class": "companion",
      "className": "Companion",
      "description": "Massive construct of fused bones. Slow but devastating.",
      "id": "pet_bone_golem",
      "isCompanion": true,
      "isPet": true,
      "level": 1,
      "name": "Bone Golem",
      "ownerClass": "necromancer"
    },
    "pet_clockwork_turret": {
      "attrs": {
        "CON": 14,
        "DEX": 8,
        "INT": 10,
        "STR": 12
      },
      "class": "companion",
      "className": "Companion",
      "description": "A brass tripod turret with a single arcane-blue eye. Springs wound tight, barrel loaded with rune-etched bolts.",
      "id": "pet_clockwork_turret",
      "isCompanion": true,
      "isPet": true,
      "level": 1,
      "name": "Clockwork Turret",
      "ownerClass": "tinker",
      "sprite": "clockwork_turret"
    },
    "pet_demon": {
      "attrs": {
        "CON": 12,
        "DEX": 10,
        "INT": 8,
        "STR": 14
      },
      "class": "companion",
      "className": "Companion",
      "description": "A summoned demon beast from the lower planes.",
      "id": "pet_demon",
      "isCompanion": true,
      "isPet": true,
      "level": 1,
      "name": "Infernal Hound",
      "ownerClass": "warlock"
    },
    "pet_familiar": {
      "attrs": {
        "CON": 8,
        "DEX": 10,
        "INT": 16,
        "STR": 4
      },
      "class": "companion",
      "className": "Companion",
      "description": "A mystical black cat wreathed in arcane runes, bound to its mage by ancient pact.",
      "id": "pet_familiar",
      "isCompanion": true,
      "isPet": true,
      "level": 1,
      "name": "Arcane Familiar",
      "ownerClass": "mage"
    },
    "pet_fire_elemental": {
      "attrs": {
        "CON": 8,
        "DEX": 8,
        "INT": 16,
        "STR": 8
      },
      "class": "companion",
      "className": "Companion",
      "description": "A living flame summoned from the ember planes.",
      "id": "pet_fire_elemental",
      "isCompanion": true,
      "isPet": true,
      "level": 1,
      "name": "Fire Elemental",
      "ownerClass": "pyromancer"
    },
    "pet_imp": {
      "attrs": {
        "CON": 6,
        "DEX": 12,
        "INT": 12,
        "STR": 6
      },
      "class": "companion",
      "className": "Companion",
      "description": "A mischievous lesser demon. Small but cunning.",
      "id": "pet_imp",
      "isCompanion": true,
      "isPet": true,
      "level": 1,
      "name": "Bound Imp",
      "ownerClass": "warlock"
    },
    "pet_lightning_elemental": {
      "attrs": {
        "CON": 6,
        "DEX": 14,
        "INT": 14,
        "STR": 6
      },
      "class": "companion",
      "className": "Companion",
      "description": "A crackling bolt given form and purpose.",
      "id": "pet_lightning_elemental",
      "isCompanion": true,
      "isPet": true,
      "level": 1,
      "name": "Lightning Elemental",
      "ownerClass": "stormcaller"
    },
    "pet_skeletal_warrior": {
      "attrs": {
        "CON": 14,
        "DEX": 8,
        "INT": 4,
        "STR": 12
      },
      "class": "companion",
      "className": "Companion",
      "description": "Undead soldier bound by dark magic. Fights with hollow determination.",
      "id": "pet_skeletal_warrior",
      "isCompanion": true,
      "isPet": true,
      "level": 1,
      "name": "Skeletal Warrior",
      "ownerClass": "necromancer"
    },
    "pet_war_hound": {
      "attrs": {
        "CON": 10,
        "DEX": 14,
        "INT": 6,
        "STR": 10
      },
      "class": "companion",
      "className": "Companion",
      "description": "An armored hunting dog trained for battle.",
      "id": "pet_war_hound",
      "isCompanion": true,
      "isPet": true,
      "level": 1,
      "name": "Trained War Hound",
      "ownerClass": "ranger"
    },
    "pet_wolf": {
      "attrs": {
        "CON": 10,
        "DEX": 14,
        "INT": 4,
        "STR": 10
      },
      "class": "companion",
      "className": "Companion",
      "description": "A wild wolf bonded through nature magic. Swift and loyal.",
      "id": "pet_wolf",
      "isCompanion": true,
      "isPet": true,
      "level": 1,
      "name": "Forest Wolf",
      "ownerClass": "druid"
    }
  },
  "companionPower": {
    "bone_hound": 2,
    "crystal_golem": 4,
    "dire_wolf": 3,
    "dragon_hatchling": 5,
    "ember_drake": 4,
    "forest_owl": 1,
    "frost_wyrmling": 5,
    "ice_sprite": 2,
    "shadow_cat": 2,
    "shadow_wyrm": 5,
    "spirit_wisp": 3,
    "storm_drake": 5,
    "swamp_frog": 1,
    "void_moth": 3,
    "war_dog": 1
  },
  "companions": [
    {
      "attrs": {
        "CON": 10,
        "DEX": 12,
        "INT": 2,
        "STR": 10
      },
      "class": "companion",
      "className": "Companion",
      "cost": 50,
      "description": "Loyal, fierce, and surprisingly effective against goblins. Bites hard.",
      "id": "war_dog",
      "isCompanion": true,
      "level": 1,
      "name": "War Dog"
    },
    {
      "attrs": {
        "CON": 8,
        "DEX": 15,
        "INT": 4,
        "STR": 8
      },
      "class": "companion",
      "className": "Companion",
      "cost": 80,
      "description": "A black-furred predator with eyes like coals. Slips between shadows; strikes from behind.",
      "id": "shadow_cat",
      "isCompanion": true,
      "level": 2,
      "name": "Shadow Cat",
      "wild": true
    },
    {
      "attrs": {
        "CON": 11,
        "DEX": 13,
        "INT": 3,
        "STR": 13
      },
      "class": "companion",
      "className": "Companion",
      "cost": 110,
      "description": "A wolf the size of a horse. Pack instinct, brutal jaws, brutal endurance.",
      "id": "dire_wolf",
      "isCompanion": true,
      "level": 3,
      "name": "Dire Wolf",
      "wild": true
    },
    {
      "attrs": {
        "CON": 7,
        "DEX": 14,
        "INT": 8,
        "STR": 6
      },
      "class": "companion",
      "className": "Companion",
      "cost": 60,
      "description": "A silent hunter from the Thornwood. Spots ambushes before they trigger.",
      "id": "forest_owl",
      "isCompanion": true,
      "level": 2,
      "name": "Forest Owl",
      "wild": true
    },
    {
      "attrs": {
        "CON": 11,
        "DEX": 11,
        "INT": 10,
        "STR": 12
      },
      "class": "companion",
      "className": "Companion",
      "cost": 220,
      "description": "A small fire-tongued drake. Not quite a dragon — but the breath still burns.",
      "id": "ember_drake",
      "isCompanion": true,
      "level": 4,
      "name": "Ember Drake",
      "wild": true
    },
    {
      "attrs": {
        "CON": 16,
        "DEX": 5,
        "INT": 2,
        "STR": 15
      },
      "class": "companion",
      "className": "Companion",
      "cost": 320,
      "description": "A construct of living crystal. Slow, heavy, almost unkillable.",
      "id": "crystal_golem",
      "isCompanion": true,
      "level": 5,
      "name": "Crystal Golem",
      "wild": true
    },
    {
      "attrs": {
        "CON": 8,
        "DEX": 12,
        "INT": 14,
        "STR": 4
      },
      "class": "companion",
      "className": "Companion",
      "cost": 240,
      "description": "A floating mote of pale light. Heals nearby allies just by drifting close.",
      "id": "spirit_wisp",
      "isCompanion": true,
      "level": 4,
      "name": "Spirit Wisp",
      "wild": true
    },
    {
      "attrs": {
        "CON": 10,
        "DEX": 13,
        "INT": 3,
        "STR": 11
      },
      "class": "companion",
      "className": "Companion",
      "cost": 180,
      "description": "A skeletal mastiff bound by old necromantic threads. Tireless. Unafraid.",
      "id": "bone_hound",
      "isCompanion": true,
      "level": 4,
      "name": "Bone Hound",
      "wild": true
    },
    {
      "attrs": {
        "CON": 7,
        "DEX": 13,
        "INT": 13,
        "STR": 5
      },
      "class": "companion",
      "className": "Companion",
      "cost": 160,
      "description": "A flickering mote of frost. Hits feel cold long after the fight ends.",
      "id": "ice_sprite",
      "isCompanion": true,
      "level": 3,
      "name": "Ice Sprite",
      "wild": true
    },
    {
      "attrs": {
        "CON": 12,
        "DEX": 10,
        "INT": 4,
        "STR": 11
      },
      "class": "companion",
      "className": "Companion",
      "cost": 90,
      "description": "A boulder-sized amphibian. Sticky tongue. Tougher than it looks.",
      "id": "swamp_frog",
      "isCompanion": true,
      "level": 3,
      "name": "Swamp Frog",
      "wild": true
    },
    {
      "attrs": {
        "CON": 9,
        "DEX": 14,
        "INT": 11,
        "STR": 7
      },
      "class": "companion",
      "className": "Companion",
      "cost": 280,
      "description": "Wings of starless black. Drifts between the lines of reality.",
      "id": "void_moth",
      "isCompanion": true,
      "level": 5,
      "name": "Void Moth",
      "wild": true
    },
    {
      "attrs": {
        "CON": 12,
        "DEX": 11,
        "INT": 14,
        "STR": 12
      },
      "class": "companion",
      "className": "Dragon Hatchling",
      "cost": 500,
      "description": "A tiny crimson dragon. Breathes dragon-fire that grows hotter as it matures. One day it will be a true dragon.",
      "id": "dragon_hatchling",